code,name,type,manager,company
001792,大成绝对收益策略混合C,混合型,黎新平,大成基金
001794,兴银朝阳债券,债券型,杨凡颖,兴银基金
001795,上投摩根文体休闲灵活配置混,混合型,周战海,上投摩根基金
001796,汇添富安鑫智选混合A,混合型,曾刚,汇添富基金
001797,华融新利灵活配置混合,混合型,靳冰馨,华融证券
001798,泰康新回报灵活配置混合A,混合型,蒋利娟,泰康资产
001799,泰康新回报灵活配置混合C,混合型,蒋利娟,泰康资产
001800,华安新乐享保本混合,基金规模,华安基金,基金评级
001801,汇添富达欣混合A,混合型,李怀定,汇添富基金
001802,易方达瑞财混合I,混合型,胡剑,易方达基金
001803,易方达瑞财混合E,混合型,胡剑,易方达基金
001806,易方达瑞智灵活配置混合I,混合型,胡剑,易方达基金
001807,易方达瑞智灵活配置混合E,混合型,胡剑,易方达基金
001808,银华互联网主题灵活配置混合,混合型,王浩,银华基金
001809,中信建投智信物联网A,混合型,王浩,中信建投基金
001810,中欧潜力价值灵活配置混合,混合型,曹名长,中欧基金
001811,中欧明睿新常态混合,混合型,周应波,中欧基金
001812,嘉实货币E,货币型,李曈,嘉实基金
001813,国泰福益灵活配置混合,混合型,樊利安,国泰基金
001814,新华阿鑫二号保本,基金规模,新华基金,基金评级
001815,华泰柏瑞激励动力混合A,混合型,徐晓杰,华泰柏瑞基金
001816,汇添富新睿精选混合A,混合型,李怀定,汇添富基金
001817,易方达瑞兴灵活配置混合I,混合型,胡剑,易方达基金
001818,易方达瑞兴灵活配置混合E,混合型,胡剑,易方达基金
001819,兴全稳益债券,债券型,翟秀华,兴全基金
001820,兴全天添益货币A,货币型,张睿,兴全基金
001821,兴全天添益货币B,货币型,张睿,兴全基金
001822,华商智能生活灵活配置混合,混合型,马国江,华商基金
001823,光大鼎鑫混合C,混合型,何奇,光大保德信基金
001824,博时沪港深成长企业,混合型,张溪冈,博时基金
001825,建信中国制造2025,股票型,孙晟,建信基金
001826,国寿安保增金宝货币,货币型,黄力,国寿安保基金
001827,富国研究优选沪港深混合,混合型,李晓铭,富国基金
001829,北信瑞丰中国智造主题,混合型,高峰,北信瑞丰
001830,融通跨界成长灵活配置混合,混合型,商小虎,融通基金
001834,长盛战略新兴产业混合C,混合型,李琪,长盛基金
001837,前海开源沪港深蓝筹精选混合,混合型,曲扬,前海开源基金
001838,国投瑞银国家安全混合,混合型,李轩,国投瑞银基金
001839,九泰久兴灵活配置混合,混合型,王玥晰,九泰基金
001840,招商丰享混合C,混合型,何文韬,招商基金
001841,招商丰享混合A,混合型,何文韬,招商基金
001842,九泰日添金货币A,货币型,王玥晰,九泰基金
001843,九泰日添金货币B,货币型,王玥晰,九泰基金
001844,九泰久益混合C,混合型,王玥晰,九泰基金
001845,国寿安保稳恒混合A,混合型,吴闻,国寿安保基金
001846,国寿安保稳健回报混合A,混合型,吴闻,国寿安保基金
001847,国寿安保尊盈一年债券A,定开债券,董瑞倩,国寿安保基金
001848,国寿安保尊盈一年债券C,定开债券,董瑞倩,国寿安保基金
001849,前海开源强势共识100强股,股票型,谢屹,前海开源基金
001850,国泰安益灵活配置混合A,混合型,樊利安,国泰基金
001851,中融强国制造混合,混合型,沈潼,中融基金
001852,融通中国风1号灵活配置混合,混合型,范琨,融通基金
001854,景顺长城景颐增利债券A,债券型,毛从容,景顺长城基金
001855,景顺长城景颐增利债券C,债券型,毛从容,景顺长城基金
001856,易方达环保主题混合,混合型,王超,易方达基金
001858,建信安心保本二号混合,基金规模,建信基金,基金评级
001859,大摩增值18个月开放债券A,定开债券,张雪,摩根士丹利华鑫基金
001860,大摩增值18个月开放债券C,定开债券,张雪,摩根士丹利华鑫基金
001861,富安达健康人生混合,混合型,李守峰,富安达基金
001862,东方红收益增强债券A,债券型,纪文静,上海东方证券资产管理
001863,东方红收益增强债券C,债券型,纪文静,上海东方证券资产管理
001864,中海魅力长三角混合,混合型,于航,中海基金
001865,前海开源事件驱动混合C,混合型,王霞,前海开源基金
001866,北信瑞丰新成长,混合型,于军华,北信瑞丰
001867,诺安聚鑫宝货币D,货币型,谢志华,诺安基金
001868,招商产业债券C,债券型,马龙,招商基金
001869,招商制造业混合A,混合型,王景,招商基金
001870,前海开源货币A,货币型,刘静,前海开源基金
001871,前海开源货币B,货币型,刘静,前海开源基金
001872,嘉实丰益信用定期债券C,定开债券,刘宁,嘉实基金
001873,嘉实增强收益定期债券C,定开债券,胡永青,嘉实基金
001874,前海开源沪港深价值精选混合,混合型,曲扬,前海开源基金
001875,前海开源沪港深优势精选混合,混合型,曲扬,前海开源基金
001876,鹏华全球高收益债美元现汇,QDII,尤柏年,鹏华基金
001877,宝盈国家安全沪港深股票,股票型,易祚兴,宝盈基金
001878,嘉实沪港深精选股票,股票型,张金涛,嘉实基金
001879,长城创新动力灵活配置混合,混合型,赵波,长城基金
001880,长城中国智造灵活配置混合,混合型,谭小兵,长城基金
001881,中欧新趋势混合(LOF)E,混合型,周蔚文,中欧基金
001882,中欧价值发现混合E,混合型,曹名长,中欧基金
001883,中欧新动力混合(LOF)E,混合型,王健,中欧基金
001884,中欧沪深300指数增强E,股票指数,曲径,中欧基金
001885,中欧新蓝筹混合E,混合型,周蔚文,中欧基金
001886,中欧行业成长混合(LOF),混合型,李欣,中欧基金
001887,中欧价值智选混合E,混合型,吴鹏飞,中欧基金
001888,中欧盛世成长混合(LOF),混合型,魏博,中欧基金
001889,中欧增强回报债券(LOF)E,债券型,朱晨杰,中欧基金
001890,中欧精选定期开放混合E,混合型,周蔚文,中欧基金
001891,中欧成长优选混合E,混合型,庄波,中欧基金
001892,长盛新兴成长混合,混合型,赵楠,长盛基金
001893,华宝兴业现金添益B,货币型,陈昕,华宝基金
001894,泰达宏利活期友货币A,货币型,王靖,泰达宏利基金
001895,泰达宏利活期友货币B,货币型,王靖,泰达宏利基金
001896,泰达宏利绝对混合,混合型,刘欣,泰达宏利基金
001897,九泰久盛量化先锋混合A,混合型,孟亚强,九泰基金
001898,易方达大健康混合,混合型,萧楠,易方达基金
001899,东海社会安全,股票指数,胡德军,东海基金
001901,前海开源沪港深隆鑫混合A,混合型,赵雪芹,前海开源基金
001902,前海开源沪港深隆鑫混合C,混合型,赵雪芹,前海开源基金
001903,光大欣鑫混合A,混合型,蔡乐,光大保德信基金
001904,光大欣鑫混合C,混合型,蔡乐,光大保德信基金
001905,华安安益保本混合,基金规模,华安基金,基金评级
001906,东方红纯债债券,债券型,纪文静,上海东方证券资产管理
001907,国投瑞银境煊保本混合A,基金规模,国投瑞银基金,基金评级
001908,国投瑞银境煊保本混合C,基金规模,国投瑞银基金,基金评级
001909,创金合信货币,货币型,蒋小玲,创金合信基金
001910,泰康新机遇混合,混合型,桂跃强,泰康资产
001911,博时裕恒纯债债券,债券型,鲁邦旺,博时基金
001912,中欧强势多策略债券,定开债券,朱晨杰,中欧基金
001914,中信建投稳利保本2号,基金规模,中信建投基金,基金评级
001915,宝盈医疗健康沪港深股票,股票型,段鹏程,宝盈基金
001916,新沃通宝A,货币型,俞瓅,新沃基金
001917,招商量化精选股票,股票型,王平,招商基金
001918,圆信永丰兴利A,债券型,许燕,圆信永丰基金
001919,圆信永丰兴利C,债券型,许燕,圆信永丰基金
001920,景顺长城景颐宏利债券A,债券型,毛从容,景顺长城基金
001921,景顺长城景颐宏利债券C,债券型,毛从容,景顺长城基金
001922,国泰新目标收益保本混合,基金规模,国泰基金,基金评级
001923,国泰添益灵活配置混合,混合型,樊利安,国泰基金
001924,华夏国企改革混合,混合型,郑晓辉,华夏基金
001925,兴业鑫天盈货币A,货币型,雷志强,兴业基金
001926,兴业鑫天盈货币B,货币型,雷志强,兴业基金
001927,华夏消费升级灵活配置混合A,混合型,黄文倩,华夏基金
001928,华夏消费升级灵活配置混合C,混合型,黄文倩,华夏基金
001929,华夏收益宝货币A,货币型,周飞,华夏基金
001930,华夏收益宝货币B,货币型,周飞,华夏基金
001931,国寿安保鑫钱包货币,货币型,桑迎,国寿安保基金
001932,国寿安保保本混合,基金规模,国寿安保基金,基金评级
001933,华商新兴活力混合,混合型,何奇峰,华商基金
001934,国泰全球绝对收益美元现钞,QDII,吴向军,国泰基金
001935,国泰全球绝对收益美元现汇,QDII,吴向军,国泰基金
001936,国泰全球绝对收益人民币,QDII,吴向军,国泰基金
001937,兴银现金增利货币,货币型,陈博亮,兴银基金
001938,中欧时代先锋股票A,股票型,周应波,中欧基金
001939,光大睿鑫混合A,混合型,蔡乐,光大保德信基金
001940,农银现代农业加,混合型,郭世凯,农银汇理基金
001941,融通通源短融债券B,债券型,黄浩荣,融通基金
001942,前海开源沪港深汇鑫混合A,混合型,谢屹,前海开源基金
001943,前海开源沪港深汇鑫混合C,混合型,谢屹,前海开源基金
001945,东方红信用债债券A,债券型,纪文静,上海东方证券资产管理
001946,东方红信用债债券C,债券型,纪文静,上海东方证券资产管理
001947,上投摩根安鑫回报A,混合型,聂曙光,上投摩根基金
001948,建信稳定丰利债券A,债券型,黎颖芳,建信基金
001949,建信稳定丰利债券C,债券型,黎颖芳,建信基金
001950,鹏华丰泰定开债B,定开债券,戴钢,鹏华基金
001951,金鹰改革红利混合,混合型,于利强,金鹰基金
001952,光大尊尚一年定开债A,定开债券,蔡乐,光大保德信基金
001953,光大尊尚一年定开债C,定开债券,蔡乐,光大保德信基金
001954,银华生态环保主题灵活配置混合,混合型,王海峰,银华基金
001955,中欧养老产业混合,混合型,王健,中欧基金
001956,国联安科技动力,股票型,潘明,国联安基金
001959,华商乐享互联灵活配置混合,混合型,高兵,华商基金
001960,兴银瑞益,债券型,洪木妹,兴银基金
001961,博时裕荣纯债债券,债券型,鲁邦旺,博时基金
001963,中欧天禧债券,债券型,孙甜,中欧基金
001964,诺安泰鑫一年定开债C,定开债券,岳帅,诺安基金
001965,圆信永丰兴源灵活配置混合A,混合型,范妍,圆信永丰基金
001966,圆信永丰兴源灵活配置混合C,混合型,范妍,圆信永丰基金
001967,华宝转型升级混合,混合型,区伟良,华宝基金
001968,光大尊盈半年定开债A,定开债券,蔡乐,光大保德信基金
001969,光大尊盈半年定开债C,定开债券,蔡乐,光大保德信基金
001970,泰信鑫选灵活配置混合A,混合型,董山青,泰信基金
001971,博时产业债纯债债券C,债券型,黄海峰,博时基金
001972,前海开源沪港深智慧生活混合,混合型,赵雪芹,前海开源基金
001973,光大耀钱包货币A,货币型,蔡乐,光大保德信基金
001974,景顺长城量化新动力股票,股票型,黎海威,景顺长城基金
001975,景顺长城环保优势股票,股票型,杨锐文,景顺长城基金
001976,海富通一年定开债C,定开债券,陈轶平,海富通基金
001978,泰信互联网+混合,混合型,钱鑫,泰信基金
001979,南方沪港深价值,混合型,刘霄汉,南方基金
001981,富国收益宝交易型货币A,货币型,王颀亮,富国基金
001982,富国收益宝交易型货币B,货币型,王颀亮,富国基金
001983,中邮低碳配置混合,混合型,张腾,中邮基金
001984,上投摩根智慧生活混合,混合型,杨景喻,上投摩根基金
001985,富国低碳新经济混合,混合型,杨栋,富国基金
001986,前海开源人工智能主题混合,混合型,曲扬,前海开源基金
001987,东方金元宝货币,货币型,姚航,东方基金
001988,南方纯元A,债券型,刘文良,南方基金
001989,南方纯元C,债券型,刘文良,南方基金
001990,中欧数据挖掘混合A,混合型,曲径,中欧基金
001991,农银天天利货币A,货币型,黄晓鹏,农银汇理基金
001992,农银天天利货币B,货币型,史向明,农银汇理基金
001993,博时裕泰纯债债券,债券型,鲁邦旺,博时基金
001994,华安年年红债券C,定开债券,郑可成,华安基金
001997,工银新趋势灵活配置混合C,混合型,游凛峰,工银瑞信基金
001998,工银新焦点混合C,混合型,游凛峰,工银瑞信基金
001999,博时安荣18个月定开债,定开债券,黄海峰,博时基金
002000,工银新生利混合,混合型,李敏,工银瑞信基金
002001,华夏回报混合A,混合型,蔡向阳,华夏基金
002003,工银新机遇灵活配置混合A,混合型,游凛峰,工银瑞信基金
002004,工银新机遇灵活配置混合C,混合型,胡志利,工银瑞信基金
002005,工银新得利混合,混合型,李敏,工银瑞信基金
002006,工银新得益混合,混合型,魏欣,工银瑞信基金
002007,工银新得润混合,混合型,李敏,工银瑞信基金
002008,博时裕晟纯债债券,债券型,鲁邦旺,博时基金
002009,中欧瑾通灵活配置混合A,混合型,张跃鹏,中欧基金
002010,中欧瑾通灵活配置混合C,混合型,张跃鹏,中欧基金
002011,华夏红利,混合型,赵航,华夏基金
002013,中欧琪丰灵活配置混合A,混合型,孙甜,中欧基金
002014,中欧琪丰灵活配置混合C,混合型,孙甜,中欧基金
002015,南方荣光A,混合型,陶铄,南方基金
002016,南方荣光C,混合型,陶铄,南方基金
002017,招商瑞丰灵活配置混合发起式C,混合型,王刚,招商基金
002018,鹏华弘安混合A,混合型,李君,鹏华基金
002019,鹏华弘安混合C,混合型,李君,鹏华基金
002020,国都创新驱动,混合型,游典宗,国都证券
002021,华夏回报二号混合,混合型,蔡向阳,华夏基金
002023,红塔红土稳健回报A,混合型,赵耀,红塔红土
002024,红塔红土稳健回报C,混合型,赵耀,红塔红土
002025,广发聚盛混合A,混合型,王予柯,广发基金
002026,广发聚盛混合C,混合型,王予柯,广发基金
002027,中加心享混合A,混合型,张旭,中加基金
002028,九泰天宝灵活配置混合C,混合型,王玥晰,九泰基金
002029,安信动态策略混合C,混合型,蓝雁书,安信基金
002030,信诚新选混合B,混合型,提云涛,信诚基金
002031,华夏策略精选,混合型,林晶,华夏基金
002033,华安新财富灵活配置混合A,混合型,苏玉平,华安基金
002034,华安新财富灵活配置混合C,混合型,苏玉平,华安基金
002035,安信平稳增长混合发起C,混合型,庄园,安信基金
002036,安信优势增长混合C,混合型,聂世林,安信基金
002037,华安新希望灵活配置混合A,混合型,贺涛,华安基金
002038,华安新希望灵活配置混合C,混合型,贺涛,华安基金
002039,国投瑞银新收益混合A,混合型,殷瑞飞,国投瑞银基金
002040,国投瑞银新收益混合C,混合型,殷瑞飞,国投瑞银基金
002041,国投瑞银新成长混合A,混合型,桑俊,国投瑞银基金
002042,国投瑞银新成长混合C,混合型,桑俊,国投瑞银基金
002043,天治研究驱动混合C,混合型,王洋,天治基金
002045,国泰生益灵活配置混合C,混合型,樊利安,国泰基金
002046,信诚新锐混合B,混合型,杨立春,信诚基金
002047,信诚新鑫混合B,混合型,杨立春,信诚基金
002048,博时安誉18个月定开债,定开债券,陈凯杨,博时基金
002049,融通新机遇灵活配置混合,混合型,余志勇,融通基金
002051,诺安创新驱动混合C,混合型,吴博俊,诺安基金
002052,诺安稳健回报灵活配置混合C,混合型,吴博俊,诺安基金
002053,诺安优势行业混合C,混合型,吴博俊,诺安基金
002054,中银新财富混合A,混合型,钱亚风云,中银基金
002055,国泰兴益灵活配置混合C,混合型,樊利安,国泰基金
002056,中银新财富混合C,混合型,钱亚风云,中银基金
002057,中银新机遇混合A,混合型,白洁,中银基金
002058,中银新机遇混合C,混合型,白洁,中银基金
002059,国泰浓益灵活配置混合C,混合型,樊利安,国泰基金
002060,东方新策略灵活配置混合C,混合型,朱晓栋,东方基金
002061,国泰安康养老定期支付混合C,混合型,王琳,国泰基金
002062,国泰国策驱动灵活配置混合C,混合型,樊利安,国泰基金
002063,国泰结构转型灵活配置混合C,混合型,樊利安,国泰基金
002064,华富产业升级灵活配置混合,混合型,陈启明,华富基金
002065,景顺长城景盛双息收益债券A,债券型,陈文鹏,景顺长城基金
002066,景顺长城景盛双息收益债券C,债券型,陈文鹏,景顺长城基金
002067,诺安精选回报混合,混合型,李玉良,诺安基金
002068,东方多策略灵活配置混合C,混合型,朱晓栋,东方基金
002069,华泰柏瑞盛利混合A,混合型,杨景涵,华泰柏瑞基金
002070,华泰柏瑞盛利混合C,混合型,杨景涵,华泰柏瑞基金
002071,长安产业精选混合C,混合型,栾绍菲,长安基金
002072,长安鑫利优选混合C,混合型,林忠晶,长安基金
002073,圆信永丰兴融A,债券型,许燕,圆信永丰基金
002074,圆信永丰兴融C,债券型,许燕,圆信永丰基金
002075,光大睿鑫混合C,混合型,蔡乐,光大保德信基金
002076,浙商聚潮灵活配置,混合型,周锦程,浙商基金
002077,浙商日添利A,货币型,周锦程,浙商基金
002078,浙商日添利B,货币型,吕文晔,浙商基金
002079,前海开源中国稀缺资产混合C,混合型,曲扬,前海开源基金
002080,前海开源一带一路混合C,混合型,徐立平,前海开源基金
002081,大成景沛灵活配置混合A,混合型,张文平,大成基金
002082,华泰柏瑞激励动力混合C,混合型,徐晓杰,华泰柏瑞基金
002083,新华鑫动力灵活配置混合A,混合型,李会忠,新华基金
002084,新华鑫动力灵活配置混合C,混合型,李会忠,新华基金
002085,长盛互联网+混合,混合型,赵楠,长盛基金
002086,大成景安短融债券E,债券型,张文平,大成基金
002087,国富新机遇混合A,混合型,吴西燕,国海富兰克林基金
002088,国富新机遇混合C,混合型,吴西燕,国海富兰克林基金
002089,长盛盛鑫混合A,混合型,杨衡,长盛基金
002090,长盛盛鑫混合C,混合型,杨衡,长盛基金
002091,华泰柏瑞新利混合C,混合型,杨景涵,华泰柏瑞基金
002092,国富新增长混合A,混合型,吴西燕,国海富兰克林基金
002093,国富新增长混合C,混合型,吴西燕,国海富兰克林基金
002094,华泰柏瑞制造2025混合C,混合型,李灿,华泰柏瑞基金
002095,博时新收益A,混合型,王曦,博时基金
002096,博时新收益C,混合型,过钧,博时基金
002097,国富新价值混合A,混合型,吴西燕,国海富兰克林基金
002098,国富新价值混合C,混合型,吴西燕,国海富兰克林基金
002099,国富新活力混合A,混合型,吴西燕,国海富兰克林基金
002100,国富新活力混合C,混合型,吴西燕,国海富兰克林基金
002101,创金合信鑫优选混合A,混合型,张荣,创金合信基金
002102,创金合信鑫优选混合C,混合型,张荣,创金合信基金
002103,招商康泰养老混合,混合型,王景,招商基金
002104,博时新价值A,混合型,王曦,博时基金
002105,博时新价值C,混合型,王曦,博时基金
002106,德邦福鑫灵活配置混合C,混合型,许文波,德邦基金
002109,博时裕丰纯债3个月定开债,定开债券,鲁邦旺,博时基金
002110,中海中鑫灵活配置混合,混合型,许定晴,中海基金
002111,华宝兴业新起点混合,混合型,李栋梁,华宝基金
002112,德邦鑫星价值灵活配置混合C,混合型,许文波,德邦基金
002114,国富新收益混合A,混合型,吴西燕,国海富兰克林基金
002115,国富新收益混合C,混合型,吴西燕,国海富兰克林基金
002116,广发安享混合A,混合型,谢军,广发基金
002117,广发安享混合C,混合型,谢军,广发基金
002118,广发安盈混合A,混合型,任爽,广发基金
002119,广发安盈混合C,混合型,任爽,广发基金
002120,广发安悦混合,混合型,谢军,广发基金
002121,广发沪港深新起点股票,股票型,李耀柱,广发基金
002123,北信瑞丰外延增长,混合型,吴洋,北信瑞丰
002124,广发新兴产业混合,混合型,李巍,广发基金
002125,广发新兴成长混合,混合型,李巍,广发基金
002128,广发鑫惠混合,混合型,任爽,广发基金
002129,广发鑫利混合,混合型,谢军,广发基金
002130,广发鑫隆混合A,混合型,王予柯,广发基金
002131,广发鑫隆混合C,混合型,王予柯,广发基金
002132,广发鑫享混合,混合型,易阳方,广发基金
002133,广发鑫益混合,混合型,任爽,广发基金
002134,广发鑫裕混合,混合型,张芊,广发基金
002135,广发鑫源混合A,混合型,谭昌杰,广发基金
002136,广发鑫源混合C,混合型,谭昌杰,广发基金
002137,诺安利鑫保本混合,基金规模,诺安基金,基金评级
002138,泓德裕泰债券A,债券型,邬传雁,泓德基金
002139,泓德裕泰债券C,债券型,邬传雁,泓德基金
002140,博时裕诚纯债债券,债券型,陈凯杨,博时基金
002141,建信鑫丰回报灵活配置混合C,混合型,牛兴华,建信基金
002142,博时外延增长主题灵活配置混,混合型,蔡滨,博时基金
002143,博时裕坤纯债,债券型,鲁邦旺,博时基金
002144,华安新优选灵活配置混合C,混合型,郑可成,华安基金
002145,诺安景鑫保本混合,基金规模,诺安基金,基金评级
002146,长安鑫益增强混合A,混合型,乔哲,长安基金
002147,长安鑫益增强混合C,混合型,乔哲,长安基金
002148,国寿安保稳惠混合,混合型,吴坚,国寿安保基金
002149,嘉实新优选混合,混合型,刘宁,嘉实基金
002152,华宝核心优势混合,混合型,胡戈游,华宝基金
002153,华安安润灵活配置混合A,混合型,郑可成,华安基金
002154,华安安润灵活配置混合C,混合型,郑可成,华安基金
002155,国金鑫瑞灵活配置混合,混合型,宫雪,国金基金
002156,长盛盛世混合A,混合型,冯雨生,长盛基金
002157,长盛盛世混合C,混合型,李琪,长盛基金
002158,汇添富安鑫智选混合C,混合型,曾刚,汇添富基金
002159,东吴国企改革,混合型,秦斌,东吴基金
002160,南方驱动混合,混合型,应帅,南方基金
002161,银华万物互联灵活配置混合,混合型,哈默,银华基金
002162,东方新价值混合C,混合型,薛子徵,东方基金
002163,东方惠新灵活配置混合C,混合型,周薇,东方基金
002164,汇添富新睿精选混合C,混合型,李怀定,汇添富基金
002165,汇添富达欣混合C,混合型,李怀定,汇添富基金
002166,华夏永福养老理财混合C,混合型,何家琪,华夏基金
002167,南方顺康,基金规模,南方基金,基金评级
002168,嘉实智能汽车股票,股票型,柏重波,嘉实基金
002169,永赢稳益债券,债券型,祁洁萍,永赢基金
002170,东吴移动互联C,混合型,刘元海,东吴基金
002172,海富通新内需混合C,混合型,谈云飞,海富通基金
002173,东方大健康混合,混合型,薛子徵,东方基金
002174,东方互联网嘉混合,混合型,郭瑞,东方基金
002175,博时裕乾纯债A,债券型,黄海峰,博时基金
002177,信诚新泽B,混合型,杨旭,信诚基金
002178,嘉实新起点混合C,混合型,王茜,嘉实基金
002179,华安事件驱动量化策略混合,混合型,牛勇,华安基金
002180,中银移动互联灵活配置混合,混合型,王帅,中银基金
002181,华安大安全混合,混合型,苏圻涵,华安基金
002182,东兴蓝海财富混合,混合型,孙继青,东兴证券
002183,广发天天红货币B,货币型,任爽,广发基金
002184,泓德泓利货币A,货币型,邬传雁,泓德基金
002185,泓德泓利货币B,货币型,邬传雁,泓德基金
002186,国联安鑫享灵活配置混合C,混合型,薛琳,国联安基金
002187,国联安鑫富混合C,混合型,吕中凡,国联安基金
002188,鹏华丰华债券,债券型,祝松,鹏华基金
002189,农银汇理国企改革混合,混合型,张峰,农银汇理基金
002190,农银新能源主题,混合型,顾旭俊,农银汇理基金
002191,农银物联网混合,混合型,韩林,农银汇理基金
002192,东方鼎新灵活配置混合C,混合型,周薇,东方基金
002193,东方利群混合C,混合型,朱晓栋,东方基金
002194,北信瑞丰稳定增强偏债混合,混合型,郑猛,北信瑞丰
002195,中银机构现金管理货币,货币型,方抗,中银基金
002196,金鹰技术领先灵活配置混合C,混合型,王喆,金鹰基金
002197,国泰鑫保本混合,基金规模,国泰基金,基金评级
002198,博时裕达纯债债券,债券型,鲁邦旺,博时基金
002199,前海开源中证军工指数C,股票指数,薛小波,前海开源基金
002200,大成慧成货币A,货币型,王立,大成基金
002201,大成慧成货币B,货币型,王立,大成基金
002202,大成慧成货币E,货币型,王立,大成基金
002203,国泰睿信平衡混合,混合型,王琳,国泰基金
002206,博时裕康纯债债券,债券型,鲁邦旺,博时基金
002207,前海开源金银珠宝混合C,混合型,谢屹,前海开源基金
002208,博时境源保本A,基金规模,博时基金,基金评级
002209,博时境源保本C,基金规模,博时基金,基金评级
